"7526295141597";"G-String noir en dentelle";"BABL969";"9,35";"0,00";"9,35";"6,90";"0,00";"€";"Mode & Accessoires > Lingerie > Homme > Strings";"3223327751";"string";"http://action.metaffiliation.com/trk.php?mclic=P466B753FC3113S1UA4593541597V3";"";"Baci";"0";"Beauty inside the beast invite chaque femme à révéler l?animal qui sommeille en elle. Féline, cette lingerie du soir donne libre cours à une féminité pleinement assumée.";"";"";"";"0";"0";"0";"0";"0";"0";"http://img.metaffiliation.com/c/79/26295/686/photo_4593541597g";"http://img.metaffiliation.com/c/79/26295/686/photo_4593541597g";"http://img.metaffiliation.com/c/79/26295/686/photo_4593541597g";"http://action.metaffiliation.com/trk.php?maff=P466B753FC3113S1UA4593541597V3";"";"";"http://diz1vnif06id7.cloudfront.net/media/catalog/product/B/A/BABL969.jpg"
"7526295141599";"G-String noir avec motif zèbre";"BABL979";"10,40";"0,00";"10,40";"6,90";"0,00";"€";"Mode & Accessoires > Lingerie > Homme > Strings";"3223327751";"string";"http://action.metaffiliation.com/trk.php?mclic=P466B753FC3113S1UA4593541599V3";"";"Baci";"0";"Beauty inside the beast invite chaque femme à révéler l?animal qui sommeille en elle. Féline, cette lingerie du soir donne libre cours à une féminité pleinement assumée.";"";"";"";"0";"1";"0";"0";"0";"0";"http://img.metaffiliation.com/c/79/26295/688/photo_4593541599g";"http://img.metaffiliation.com/c/79/26295/688/photo_4593541599g";"http://img.metaffiliation.com/c/79/26295/688/photo_4593541599g";"http://action.metaffiliation.com/trk.php?maff=P466B753FC3113S1UA4593541599V3";"";"";"http://diz1vnif06id7.cloudfront.net/media/catalog/product/B/A/BABL979.jpg"
"7526295141601";"Shorty noir avec motif zèbre";"BABL980";"11,55";"0,00";"11,55";"6,90";"0,00";"€";"Mode & Accessoires > Lingerie > Homme > Strings";"3223327751";"string";"http://action.metaffiliation.com/trk.php?mclic=P466B753FC3113S1UA4593541601V3";"";"Baci";"0";"Beauty inside the beast invite chaque femme à révéler l?animal qui sommeille en elle. Féline, cette lingerie du soir donne libre cours à une féminité pleinement assumée.";"";"";"";"0";"0";"0";"0";"0";"0";"http://img.metaffiliation.com/c/79/26295/690/photo_4593541601g";"http://img.metaffiliation.com/c/79/26295/690/photo_4593541601g";"http://img.metaffiliation.com/c/79/26295/690/photo_4593541601g";"http://action.metaffiliation.com/trk.php?maff=P466B753FC3113S1UA4593541601V3";"";"";"http://diz1vnif06id7.cloudfront.net/media/catalog/product/B/A/BABL980.jpg"
"7526295141603";"Ensemble soutien gorge triangle microfibres couleur chair avec G-string échancré assorti";"BABL987";"20,90";"0,00";"20,90";"6,90";"0,00";"€";"Mode & Accessoires > Lingerie > Homme > Strings";"3223327751";"string";"http://action.metaffiliation.com/trk.php?mclic=P466B753FC3113S1UA4593541603V3";"";"Baci";"0";"Beauty inside the beast invite chaque femme à révéler l?animal qui sommeille en elle. Féline, cette lingerie du soir donne libre cours à une féminité pleinement assumée.";"";"";"";"0";"0";"0";"0";"0";"0";"http://img.metaffiliation.com/c/79/26295/692/photo_4593541603g";"http://img.metaffiliation.com/c/79/26295/692/photo_4593541603g";"http://img.metaffiliation.com/c/79/26295/692/photo_4593541603g";"http://action.metaffiliation.com/trk.php?maff=P466B753FC3113S1UA4593541603V3";"";"";"http://diz1vnif06id7.cloudfront.net/media/catalog/product/B/A/BABL987.jpg"
"7526295141605";"Ensemble soutien gorge triangle microfibres noir avec G-string échancré assorti";"BABL988";"20,90";"0,00";"20,90";"6,90";"0,00";"€";"Mode & Accessoires > Lingerie > Homme > Strings";"3223327751";"string";"http://action.metaffiliation.com/trk.php?mclic=P466B753FC3113S1UA4593541605V3";"";"Baci";"0";"Beauty inside the beast invite chaque femme à révéler l?animal qui sommeille en elle. Féline, cette lingerie du soir donne libre cours à une féminité pleinement assumée.";"";"";"";"0";"0";"0";"0";"0";"0";"http://img.metaffiliation.com/c/79/26295/694/photo_4593541605g";"http://img.metaffiliation.com/c/79/26295/694/photo_4593541605g";"http://img.metaffiliation.com/c/79/26295/694/photo_4593541605g";"http://action.metaffiliation.com/trk.php?maff=P466B753FC3113S1UA4593541605V3";"";"";"http://diz1vnif06id7.cloudfront.net/media/catalog/product/B/A/BABL988.jpg"
"7526295141607";"Ensemble soutien gorge triangle microfibres chocolat avec G-string échancré assorti";"BABL989";"20,90";"0,00";"20,90";"6,90";"0,00";"€";"Mode & Accessoires > Lingerie > Homme > Strings";"3223327751";"string";"http://action.metaffiliation.com/trk.php?mclic=P466B753FC3113S1UA4593541607V3";"";"Baci";"0";"Beauty inside the beast invite chaque femme à révéler l?animal qui sommeille en elle. Féline, cette lingerie du soir donne libre cours à une féminité pleinement assumée.";"";"";"";"0";"1";"0";"0";"0";"0";"http://img.metaffiliation.com/c/79/26295/696/photo_4593541607g";"http://img.metaffiliation.com/c/79/26295/696/photo_4593541607g";"http://img.metaffiliation.com/c/79/26295/696/photo_4593541607g";"http://action.metaffiliation.com/trk.php?maff=P466B753FC3113S1UA4593541607V3";"";"";"http://diz1vnif06id7.cloudfront.net/media/catalog/product/9/8/989_image_model_back.jpg"
"7526295141609";"G-String en dentelle couleur ivoire";"BABL996";"9,45";"0,00";"9,45";"6,90";"0,00";"€";"Mode & Accessoires > Lingerie > Homme > Strings";"3223327751";"string";"http://action.metaffiliation.com/trk.php?mclic=P466B753FC3113S1UA4593541609V3";"";"Baci";"0";"Beauty inside the beast invite chaque femme à révéler l?animal qui sommeille en elle. Féline, cette lingerie du soir donne libre cours à une féminité pleinement assumée.";"";"";"";"0";"1";"0";"0";"0";"0";"http://img.metaffiliation.com/c/79/26295/698/photo_4593541609g";"http://img.metaffiliation.com/c/79/26295/698/photo_4593541609g";"http://img.metaffiliation.com/c/79/26295/698/photo_4593541609g";"http://action.metaffiliation.com/trk.php?maff=P466B753FC3113S1UA4593541609V3";"";"";"http://diz1vnif06id7.cloudfront.net/media/catalog/product/9/9/996_image_model_front.jpg"
"7526295141611";"Ensemble soutien gorge ajouré avec armatures noir et porte jarretelles assorti / Taille S/M";"BABL895";"31,40";"0,00";"31,40";"6,90";"0,00";"€";"Mode & Accessoires > Lingerie > Femme";"1053703";"ensemble";"http://action.metaffiliation.com/trk.php?mclic=P466B753FC3113S1UA4593541611V3";"";"Baci";"0";"Bon baiser de Russie se réinvite à travers la collection Agent of love. Des coupes rafinées et structurées feront de vous le temps d?un porter une véritable James Bond girl.";"";"";"";"0";"0";"0";"0";"0";"0";"http://img.metaffiliation.com/c/79/26295/700/photo_4593541611g";"http://img.metaffiliation.com/c/79/26295/700/photo_4593541611g";"http://img.metaffiliation.com/c/79/26295/700/photo_4593541611g";"http://action.metaffiliation.com/trk.php?maff=P466B753FC3113S1UA4593541611V3";"";"";"http://diz1vnif06id7.cloudfront.net/media/catalog/product/B/A/BABL895.jpg"
"7526295141613";"Ensemble soutien gorge à balconnets en tulle noire avec finitions dentelle et satin contrastés avec culotte assortie / Taille S/M";"BABL904";"41,90";"0,00";"41,90";"6,90";"0,00";"€";"Mode & Accessoires > Lingerie > Femme";"1053703";"ensemble";"http://action.metaffiliation.com/trk.php?mclic=P466B753FC3113S1UA4593541613V3";"";"Baci";"0";"Bon baiser de Russie se réinvite à travers la collection Agent of love. Des coupes rafinées et structurées feront de vous le temps d?un porter une véritable James Bond girl.";"";"";"";"0";"1";"0";"0";"0";"0";"http://img.metaffiliation.com/c/79/26295/702/photo_4593541613g";"http://img.metaffiliation.com/c/79/26295/702/photo_4593541613g";"http://img.metaffiliation.com/c/79/26295/702/photo_4593541613g";"http://action.metaffiliation.com/trk.php?maff=P466B753FC3113S1UA4593541613V3";"";"";"http://diz1vnif06id7.cloudfront.net/media/catalog/product/B/A/BABL904.jpg"
"7526295141615";"Ensemble soutien gorge à balconnets en tulle noire avec finitions dentelle et satin contrastés avec G-string assortie / Taille M/L";"BABL905";"41,90";"0,00";"41,90";"6,90";"0,00";"€";"Mode & Accessoires > Lingerie > Femme";"1053703";"ensemble";"http://action.metaffiliation.com/trk.php?mclic=P466B753FC3113S1UA4593541615V3";"";"Baci";"0";"Bon baiser de Russie se réinvite à travers la collection Agent of love. Des coupes rafinées et structurées feront de vous le temps d?un porter une véritable James Bond girl.";"";"";"";"0";"1";"0";"0";"0";"0";"http://img.metaffiliation.com/c/79/26295/704/photo_4593541615g";"http://img.metaffiliation.com/c/79/26295/704/photo_4593541615g";"http://img.metaffiliation.com/c/79/26295/704/photo_4593541615g";"http://action.metaffiliation.com/trk.php?maff=P466B753FC3113S1UA4593541615V3";"";"";"http://diz1vnif06id7.cloudfront.net/media/catalog/product/B/A/BABL905.jpg"
"7526295141617";"Collants en résille rose";"BAWC112_TU";"8,30";"0,00";"8,30";"6,90";"0,00";"€";"Mode & Accessoires > Lingerie > Femme > Bas";"1074795527";"Bas";"http://action.metaffiliation.com/trk.php?mclic=P466B753FC3113S1UA4593541617V3";"";"Baci";"4890808046302";"Classiquement discret et en même temps, stimulant pour l'imagination - ces collants exquis impressionnent par leur design rose diamant attrayant, qui révèle particulièrement beaucoup de peau. Ce vêtement est un complément idéal pour toute lingerie ou pour la mode de tous les jours. Taille unique. Couleur : rose";"";"";"";"129";"1";"0";"0";"0";"0";"http://img.metaffiliation.com/c/79/26295/706/photo_4593541617g";"http://img.metaffiliation.com/c/79/26295/706/photo_4593541617g";"http://img.metaffiliation.com/c/79/26295/706/photo_4593541617g";"http://action.metaffiliation.com/trk.php?maff=P466B753FC3113S1UA4593541617V3";"";"";"http://diz1vnif06id7.cloudfront.net/media/catalog/product/B/A/BAWC112_2.jpg"
"7526295141619";"Collants résille noirs avec rubans de satin rose";"BAWC116_TU";"14,60";"0,00";"14,60";"6,90";"0,00";"€";"Mode & Accessoires > Lingerie > Femme > Bas";"1074795527";"Bas";"http://action.metaffiliation.com/trk.php?mclic=P466B753FC3113S1UA4593541619V3";"";"Baci";"4890808043134";"Ne vous contentez pas de moins! Ces collants noirs en résille classique habillent joliment vos jambes. Ils se ferment  à l'arrière, par des rubans de satin rose sur toute la longueur de la jambe à la façon d'un corset.Parfaits pour attirer l'attention Taille unique. Couleur : noir et rose.";"";"";"";"158";"1";"0";"0";"0";"0";"http://img.metaffiliation.com/c/79/26295/708/photo_4593541619g";"http://img.metaffiliation.com/c/79/26295/708/photo_4593541619g";"http://img.metaffiliation.com/c/79/26295/708/photo_4593541619g";"http://action.metaffiliation.com/trk.php?maff=P466B753FC3113S1UA4593541619V3";"";"";"http://diz1vnif06id7.cloudfront.net/media/catalog/product/B/A/BAWC116_2.jpg"
"7526295141621";"Collants en résille rose hot";"BAWC137_TU";"5,25";"0,00";"5,25";"6,90";"0,00";"€";"Mode & Accessoires > Lingerie > Femme > Bas";"1074795527";"Bas";"http://action.metaffiliation.com/trk.php?mclic=P466B753FC3113S1UA4593541621V3";"";"Baci";"4890808026366";"Ces collants roses hot laisseront libre cours à l'imagination avec leur résille qui laisse apparaitre des jambes  à la fois élégantes et sexy. Leur coupe classique vous permettra de les combiner facilement. Taille unique. Couleur : rose hot.";"";"";"";"112";"1";"0";"0";"0";"0";"http://img.metaffiliation.com/c/79/26295/710/photo_4593541621g";"http://img.metaffiliation.com/c/79/26295/710/photo_4593541621g";"http://img.metaffiliation.com/c/79/26295/710/photo_4593541621g";"http://action.metaffiliation.com/trk.php?maff=P466B753FC3113S1UA4593541621V3";"";"";"http://diz1vnif06id7.cloudfront.net/media/catalog/product/B/A/BAWC137_2.jpg"
"7526295141623";"Bas en résille couleur rouge";"BAWC179_TU";"5,25";"0,00";"5,25";"6,90";"0,00";"€";"Mode & Accessoires > Lingerie > Femme > Bas";"1074795527";"Bas";"http://action.metaffiliation.com/trk.php?mclic=P466B753FC3113S1UA4593541623V3";"";"Baci";"4890808026489";"Ces bas résille  sont LE grand classique pour votre partenaire. Pour toutes les occasions, que ce soit pour une utilisation quotidienne ou pour éblouir votre partenaire. Taille unique. Couleur : rouge.";"";"";"";"5";"0";"0";"0";"0";"0";"http://img.metaffiliation.com/c/79/26295/712/photo_4593541623g";"http://img.metaffiliation.com/c/79/26295/712/photo_4593541623g";"http://img.metaffiliation.com/c/79/26295/712/photo_4593541623g";"http://action.metaffiliation.com/trk.php?maff=P466B753FC3113S1UA4593541623V3";"";"";"http://diz1vnif06id7.cloudfront.net/media/catalog/product/B/A/BAWC179_1.jpg"
"7526295141625";"Bas couture résille rouges";"BAWC203_TU";"5,25";"0,00";"5,25";"6,90";"0,00";"€";"Mode & Accessoires > Lingerie > Femme > Bas";"1074795527";"Bas";"http://action.metaffiliation.com/trk.php?mclic=P466B753FC3113S1UA4593541625V3";"";"Baci";"4890808026533";"Ces bas résille  sont LE grand classique pour votre partenaire. Pour toutes les occasions, que ce soit pour une utilisation quotidienne ou pour éblouir votre partenaire. Taille unique. Couleur : rouge.";"";"";"";"35";"1";"0";"0";"0";"0";"http://img.metaffiliation.com/c/79/26295/714/photo_4593541625g";"http://img.metaffiliation.com/c/79/26295/714/photo_4593541625g";"http://img.metaffiliation.com/c/79/26295/714/photo_4593541625g";"http://action.metaffiliation.com/trk.php?maff=P466B753FC3113S1UA4593541625V3";"";"";"http://diz1vnif06id7.cloudfront.net/media/catalog/product/B/A/BAWC203_1.jpg"
"7526295141627";"Bas couture en résille noir avec jarretière rouge en dentelle";"BAWC206_TU";"8,30";"0,00";"8,30";"6,90";"0,00";"€";"Mode & Accessoires > Lingerie > Femme > Bas";"1074795527";"Bas";"http://action.metaffiliation.com/trk.php?mclic=P466B753FC3113S1UA4593541627V3";"";"Baci";"4890808046562";"Rendez fou votre partenaire avec ces bas très sexy. Taille unique. Couleur : noir. Et rouge";"";"";"";"0";"0";"0";"0";"0";"0";"http://img.metaffiliation.com/c/79/26295/716/photo_4593541627g";"http://img.metaffiliation.com/c/79/26295/716/photo_4593541627g";"http://img.metaffiliation.com/c/79/26295/716/photo_4593541627g";"http://action.metaffiliation.com/trk.php?maff=P466B753FC3113S1UA4593541627V3";"";"";"http://diz1vnif06id7.cloudfront.net/media/catalog/product/B/A/BAWC206_1.jpg"
"7526295141629";"Collants en résille motifs noirs";"BAWC214_TU";"12,50";"0,00";"12,50";"6,90";"0,00";"€";"Mode & Accessoires > Lingerie > Femme > Bas";"1074795527";"Bas";"http://action.metaffiliation.com/trk.php?mclic=P466B753FC3113S1UA4593541629V3";"";"Baci";"4890808043158";"Ces collants noirs en résille sauront souligner délicatement vos courbes. Taille unique. Couleur : noir.";"";"";"";"175";"1";"0";"0";"0";"0";"http://img.metaffiliation.com/c/79/26295/718/photo_4593541629g";"http://img.metaffiliation.com/c/79/26295/718/photo_4593541629g";"http://img.metaffiliation.com/c/79/26295/718/photo_4593541629g";"http://action.metaffiliation.com/trk.php?maff=P466B753FC3113S1UA4593541629V3";"";"";"http://diz1vnif06id7.cloudfront.net/media/catalog/product/B/A/BAWC214_1.jpg"
"7526295141631";"Bas couture noir avec large jarretière noire";"BAWC215_TU";"5,25";"0,00";"5,25";"6,90";"0,00";"€";"Mode & Accessoires > Lingerie > Femme > Bas";"1074795527";"Bas";"http://action.metaffiliation.com/trk.php?mclic=P466B753FC3113S1UA4593541631V3";"";"Baci";"4890808026434";"L'alliance de l'élégance et de la sensualité. Ces bas semi-transparents noirs se dinguent des bas classiques grâce à leur couture arrière accrocheuse. Taille unique. Couleur : noir.";"";"";"";"0";"0";"0";"0";"0";"0";"http://img.metaffiliation.com/c/79/26295/720/photo_4593541631g";"http://img.metaffiliation.com/c/79/26295/720/photo_4593541631g";"http://img.metaffiliation.com/c/79/26295/720/photo_4593541631g";"http://action.metaffiliation.com/trk.php?maff=P466B753FC3113S1UA4593541631V3";"";"";"http://diz1vnif06id7.cloudfront.net/media/catalog/product/B/A/BAWC215_1.jpg"
"7526295141633";"Bas en résille noire avec jarretière en vinyle";"BAWC216_TU";"16,80";"0,00";"16,80";"6,90";"0,00";"€";"Mode & Accessoires > Lingerie > Femme > Bas";"1074795527";"Bas";"http://action.metaffiliation.com/trk.php?mclic=P466B753FC3113S1UA4593541633V3";"";"Baci";"4890808046630";"Avec ces bas noirs à larges motifs ajourés, vous attirerez l'attention. Les jarretières en vinyle brillant apporte une touche sexy. Taille unique. Couleur : noir.";"";"";"";"110";"1";"0";"0";"0";"0";"http://img.metaffiliation.com/c/79/26295/722/photo_4593541633g";"http://img.metaffiliation.com/c/79/26295/722/photo_4593541633g";"http://img.metaffiliation.com/c/79/26295/722/photo_4593541633g";"http://action.metaffiliation.com/trk.php?maff=P466B753FC3113S1UA4593541633V3";"";"";"http://diz1vnif06id7.cloudfront.net/media/catalog/product/B/A/BAWC216_1.jpg"
"7526295141635";"Bas en résille couleur chair";"BAWC217_TU";"5,25";"0,00";"5,25";"6,90";"0,00";"€";"Mode & Accessoires > Lingerie > Femme > Bas";"1074795527";"Bas";"http://action.metaffiliation.com/trk.php?mclic=P466B753FC3113S1UA4593541635V3";"";"Baci";"4890808026472";"Ces bas résille  sont LE grand classique pour votre partenaire. Pour toutes les occasions, que ce soit pour une utilisation quotidienne ou pour éblouir votre partenaire. Taille unique. Couleur : chair.";"";"";"";"33";"1";"0";"0";"0";"0";"http://img.metaffiliation.com/c/79/26295/724/photo_4593541635g";"http://img.metaffiliation.com/c/79/26295/724/photo_4593541635g";"http://img.metaffiliation.com/c/79/26295/724/photo_4593541635g";"http://action.metaffiliation.com/trk.php?maff=P466B753FC3113S1UA4593541635V3";"";"";"http://diz1vnif06id7.cloudfront.net/media/catalog/product/B/A/BAWC217_1.jpg"
"7526295141637";"Bas en résille couleur rose";"BAWC218_TU";"5,25";"0,00";"5,25";"6,90";"0,00";"€";"Mode & Accessoires > Lingerie > Femme > Bas";"1074795527";"Bas";"http://action.metaffiliation.com/trk.php?mclic=P466B753FC3113S1UA4593541637V3";"";"Baci";"4890808026502";"Ces bas résille  sont LE grand classique pour votre partenaire. Pour toutes les occasions, que ce soit pour une utilisation quotidienne ou pour éblouir votre partenaire. Taille unique. Couleur : rose hot.";"";"";"";"81";"1";"0";"0";"0";"0";"http://img.metaffiliation.com/c/79/26295/726/photo_4593541637g";"http://img.metaffiliation.com/c/79/26295/726/photo_4593541637g";"http://img.metaffiliation.com/c/79/26295/726/photo_4593541637g";"http://action.metaffiliation.com/trk.php?maff=P466B753FC3113S1UA4593541637V3";"";"";"http://diz1vnif06id7.cloudfront.net/media/catalog/product/B/A/BAWC218_1.jpg"
"7526295141639";"Bas couture blancs avec large jarretière blanche";"BAWC219_TU";"5,25";"0,00";"5,25";"6,90";"0,00";"€";"Mode & Accessoires > Lingerie > Femme > Bas";"1074795527";"Bas";"http://action.metaffiliation.com/trk.php?mclic=P466B753FC3113S1UA4593541639V3";"";"Baci";"4890808026441";"L'alliance de l'élégance et de la sensualité. Ces bas semi-transparents noirs se dinguent des bas classiques grâce à leur couture arrière accrocheuse. Taille unique. Couleur : blanc.";"";"";"";"0";"0";"0";"0";"0";"0";"http://img.metaffiliation.com/c/79/26295/728/photo_4593541639g";"http://img.metaffiliation.com/c/79/26295/728/photo_4593541639g";"http://img.metaffiliation.com/c/79/26295/728/photo_4593541639g";"http://action.metaffiliation.com/trk.php?maff=P466B753FC3113S1UA4593541639V3";"";"";"http://diz1vnif06id7.cloudfront.net/media/catalog/product/B/A/BAWC219_1.jpg"
"7526295141641";"Bas couture chair avec large jarretière chair";"BAWC220_TU";"5,00";"0,00";"5,00";"6,90";"0,00";"€";"Mode & Accessoires > Lingerie > Femme > Bas";"1074795527";"Bas";"http://action.metaffiliation.com/trk.php?mclic=P466B753FC3113S1UA4593541641V3";"";"Baci";"4890808042885";"L'alliance de l'élégance et de la sensualité. Ces bas semi-transparents noirs se dinguent des bas classiques grâce à leur couture arrière accrocheuse. Taille unique. Couleur : chair.";"";"";"";"0";"0";"0";"0";"0";"0";"http://img.metaffiliation.com/c/79/26295/730/photo_4593541641g";"http://img.metaffiliation.com/c/79/26295/730/photo_4593541641g";"http://img.metaffiliation.com/c/79/26295/730/photo_4593541641g";"http://action.metaffiliation.com/trk.php?maff=P466B753FC3113S1UA4593541641V3";"";"";"http://diz1vnif06id7.cloudfront.net/media/catalog/product/B/A/BAWC220_1.jpg"
"7526295141643";"Bas résille rouges avec porte-jarretelles";"BAWC221_TU";"20,90";"0,00";"20,90";"6,90";"0,00";"€";"Mode & Accessoires > Lingerie > Femme > Bas";"1074795527";"Bas";"http://action.metaffiliation.com/trk.php?mclic=P466B753FC3113S1UA4593541643V3";"";"Baci";"4890808043059";"Un ensemble parfait et sexy : un porte-jarretelless rouge avec résille à gros grain et ses bas. Pensez aux possibilités que vous offre cet ensemble, et à l'effet sur votre partenaire. Taille unique. Couleur : rouge.";"";"";"";"127";"1";"0";"0";"0";"0";"http://img.metaffiliation.com/c/79/26295/732/photo_4593541643g";"http://img.metaffiliation.com/c/79/26295/732/photo_4593541643g";"http://img.metaffiliation.com/c/79/26295/732/photo_4593541643g";"http://action.metaffiliation.com/trk.php?maff=P466B753FC3113S1UA4593541643V3";"";"";"http://diz1vnif06id7.cloudfront.net/media/catalog/product/B/A/BAWC221_1.jpg"
"7526295141645";"Bas résille noirs";"BAWC222_TU";"8,30";"0,00";"8,30";"6,90";"0,00";"€";"Mode & Accessoires > Lingerie > Femme > Bas";"1074795527";"Bas";"http://action.metaffiliation.com/trk.php?mclic=P466B753FC3113S1UA4593541645V3";"";"Baci";"4890808043189";"Ces bas noirs en résille à larges mailles laissent une belle place à l'imagination - vous le remarquerez rapidement. Taille unique. Couleur : noir.";"";"";"";"12";"1";"0";"0";"0";"0";"http://img.metaffiliation.com/c/79/26295/734/photo_4593541645g";"http://img.metaffiliation.com/c/79/26295/734/photo_4593541645g";"http://img.metaffiliation.com/c/79/26295/734/photo_4593541645g";"http://action.metaffiliation.com/trk.php?maff=P466B753FC3113S1UA4593541645V3";"";"";"http://diz1vnif06id7.cloudfront.net/media/catalog/product/B/A/BAWC222_1.jpg"
"7526295141647";"Collants rouges en résille";"BAWC223_TU";"8,30";"0,00";"8,30";"6,90";"0,00";"€";"Mode & Accessoires > Lingerie > Femme > Bas";"1074795527";"Bas";"http://action.metaffiliation.com/trk.php?mclic=P466B753FC3113S1UA4593541647V3";"";"Baci";"4890808046289";"Ces collants  en résille à larges mailles laissent une belle place à l'imagination - vous le remarquerez rapidement. Taille unique. Couleur : rouge.";"";"";"";"310";"1";"0";"0";"0";"0";"http://img.metaffiliation.com/c/79/26295/736/photo_4593541647g";"http://img.metaffiliation.com/c/79/26295/736/photo_4593541647g";"http://img.metaffiliation.com/c/79/26295/736/photo_4593541647g";"http://action.metaffiliation.com/trk.php?maff=P466B753FC3113S1UA4593541647V3";"";"";"http://diz1vnif06id7.cloudfront.net/media/catalog/product/B/A/BAWC223_1.jpg"
"7526295141649";"Bas en résille noire";"BAWC224_TU";"7,25";"0,00";"7,25";"6,90";"0,00";"€";"Mode & Accessoires > Lingerie > Femme > Bas";"1074795527";"Bas";"http://action.metaffiliation.com/trk.php?mclic=P466B753FC3113S1UA4593541649V3";"";"Baci";"4890808046647";"Ces bas  en résille à larges mailles laissent une belle place à l'imagination - vous le remarquerez rapidement. Taille unique. Couleur : noir.";"";"";"";"24";"1";"0";"0";"0";"0";"http://img.metaffiliation.com/c/79/26295/738/photo_4593541649g";"http://img.metaffiliation.com/c/79/26295/738/photo_4593541649g";"http://img.metaffiliation.com/c/79/26295/738/photo_4593541649g";"http://action.metaffiliation.com/trk.php?maff=P466B753FC3113S1UA4593541649V3";"";"";"http://diz1vnif06id7.cloudfront.net/media/catalog/product/B/A/BAWC224_1.jpg"
"7526295142779";"G-String ajustable rose clair";"BABL1171";"9,35";"0,00";"9,35";"6,90";"0,00";"€";"Mode & Accessoires > Lingerie > Homme > Strings";"3223327751";"string";"http://action.metaffiliation.com/trk.php?mclic=P466B753FC3113S1UA4593542779V3";"";"Baci";"4890808107508";"G-String ajustable rose clair";"";"";"";"0";"1";"0";"0";"0";"0";"http://img.metaffiliation.com/c/79/26295/46/photo_4593542779g";"http://img.metaffiliation.com/c/79/26295/46/photo_4593542779g";"http://img.metaffiliation.com/c/79/26295/46/photo_4593542779g";"http://action.metaffiliation.com/trk.php?maff=P466B753FC3113S1UA4593542779V3";"";"";"http://diz1vnif06id7.cloudfront.net/media/catalog/product/1/1/1171_image_model_front.jpg"
"7526295142743";"String en microfibres et bordure en dentelle pourpre";"BAWC13_L";"7,50";"0,00";"7,50";"6,90";"0,00";"€";"Mode & Accessoires > Lingerie > Homme > Strings";"3223327751";"string";"http://action.metaffiliation.com/trk.php?mclic=P466B753FC3113S1UA4593542743V3";"";"Baci";"0";"String en microfibres et bordure en dentelle pourpre";"";"";"";"47";"1";"0";"0";"0";"0";"http://img.metaffiliation.com/c/79/26295/10/photo_4593542743g";"http://img.metaffiliation.com/c/79/26295/10/photo_4593542743g";"http://img.metaffiliation.com/c/79/26295/10/photo_4593542743g";"http://action.metaffiliation.com/trk.php?maff=P466B753FC3113S1UA4593542743V3";"";"";"http://diz1vnif06id7.cloudfront.net/media/catalog/product/B/A/BAWC132_back_21.jpg"
"7526295141651";"Tanga en tulle noire avec finitions bordure contrasté rouge et ajouré par ruban satin rouge";"BAWC166_TU";"8,30";"0,00";"8,30";"6,90";"0,00";"€";"Mode & Accessoires > Lingerie > Homme > Strings";"3223327751";"string";"http://action.metaffiliation.com/trk.php?mclic=P466B753FC3113S1UA4593541651V3";"";"Baci";"4890808027523";"Frais, séduisant et ludique. Ce tanga à l'allure originale ce ferme à l' avant comme à l'arrière à la manière d'un corset. Taille unique. Couleur : noir  bordé de rouge.";"";"";"";"0";"0";"0";"0";"0";"0";"http://img.metaffiliation.com/c/79/26295/740/photo_4593541651g";"http://img.metaffiliation.com/c/79/26295/740/photo_4593541651g";"http://img.metaffiliation.com/c/79/26295/740/photo_4593541651g";"http://action.metaffiliation.com/trk.php?maff=P466B753FC3113S1UA4593541651V3";"";"";"http://diz1vnif06id7.cloudfront.net/media/catalog/product/B/A/BAWC166_2.jpg"
