"7526295142181";"Kimono en satin champagne";"BABL944_TU";"62,90";"0,00";"62,90";"0,00";"0,00";"€";"Mode & Accessoires > Lingerie > Femme";"1053703";"kimono";"http://action.metaffiliation.com/trk.php?mclic=P466B753FC3113S1UA4593542181V3";"";"Baci";"4890808100301";"Bon baiser de Russie se réinvite à travers la collection Agent of love. Des coupes rafinées et structurées feront de vous le temps d?un porter une véritable James Bond girl.";"";"";"";"142";"1";"0";"0";"0";"0";"http://img.metaffiliation.com/c/79/26295/359/photo_4593542181g";"http://img.metaffiliation.com/c/79/26295/359/photo_4593542181g";"http://img.metaffiliation.com/c/79/26295/359/photo_4593542181g";"http://action.metaffiliation.com/trk.php?maff=P466B753FC3113S1UA4593542181V3";"";"";"http://diz1vnif06id7.cloudfront.net/media/catalog/product/B/A/BABL944.jpg"
"7526295142183";"Ensemble porte-jarretelles et bas en résille cuba noire";"BABL945_TU";"26,25";"0,00";"26,25";"6,90";"0,00";"€";"Mode & Accessoires > Lingerie > Femme > Bas";"1074795527";"Bas";"http://action.metaffiliation.com/trk.php?mclic=P466B753FC3113S1UA4593542183V3";"";"Baci";"4890808091975";"Beauty inside the beast invite chaque femme à révéler l?animal qui sommeille en elle. Féline, cette lingerie du soir donne libre cours à une féminité pleinement assumée.";"";"";"";"23";"1";"0";"0";"0";"0";"http://img.metaffiliation.com/c/79/26295/361/photo_4593542183g";"http://img.metaffiliation.com/c/79/26295/361/photo_4593542183g";"http://img.metaffiliation.com/c/79/26295/361/photo_4593542183g";"http://action.metaffiliation.com/trk.php?maff=P466B753FC3113S1UA4593542183V3";"";"";"http://diz1vnif06id7.cloudfront.net/media/catalog/product/B/A/BABL945.jpg"
"7526295142185";"Loup noir en satin avec finitions frou frou";"BABL951_TU";"15,65";"0,00";"15,65";"6,90";"0,00";"€";"Mode & Accessoires > Lingerie > Femme";"1053703";"accessoire";"http://action.metaffiliation.com/trk.php?mclic=P466B753FC3113S1UA4593542185V3";"";"Baci";"4890808100660";"Beauty inside the beast invite chaque femme à révéler l?animal qui sommeille en elle. Féline, cette lingerie du soir donne libre cours à une féminité pleinement assumée.";"";"";"";"6";"1";"0";"0";"0";"0";"http://img.metaffiliation.com/c/79/26295/363/photo_4593542185g";"http://img.metaffiliation.com/c/79/26295/363/photo_4593542185g";"http://img.metaffiliation.com/c/79/26295/363/photo_4593542185g";"http://action.metaffiliation.com/trk.php?maff=P466B753FC3113S1UA4593542185V3";"";"";"http://diz1vnif06id7.cloudfront.net/media/catalog/product/B/A/BABL951_2_6.jpg"
"7526295142187";"Combinaison résille avec décolleté dos";"BABL955_TU";"15,90";"0,00";"15,90";"6,90";"0,00";"€";"Mode & Accessoires > Lingerie > Femme > Bodys";"2148537351";"body";"http://action.metaffiliation.com/trk.php?mclic=P466B753FC3113S1UA4593542187V3";"";"Baci";"4890808091999";"Beauty inside the beast invite chaque femme à révéler l?animal qui sommeille en elle. Féline, cette lingerie du soir donne libre cours à une féminité pleinement assumée.";"";"";"";"0";"0";"0";"0";"0";"0";"http://img.metaffiliation.com/c/79/26295/365/photo_4593542187g";"http://img.metaffiliation.com/c/79/26295/365/photo_4593542187g";"http://img.metaffiliation.com/c/79/26295/365/photo_4593542187g";"http://action.metaffiliation.com/trk.php?maff=P466B753FC3113S1UA4593542187V3";"";"";"http://diz1vnif06id7.cloudfront.net/media/catalog/product/B/A/BABL955.jpg"
"7526295142189";"Loup noir en dentelle avec attache ruban satin noir";"BABL958_TU";"9,35";"0,00";"9,35";"6,90";"0,00";"€";"Mode & Accessoires > Lingerie > Femme";"1053703";"accessoire";"http://action.metaffiliation.com/trk.php?mclic=P466B753FC3113S1UA4593542189V3";"";"Baci";"4890808100707";"Beauty inside the beast invite chaque femme à révéler l?animal qui sommeille en elle. Féline, cette lingerie du soir donne libre cours à une féminité pleinement assumée.";"";"";"";"98";"1";"0";"0";"0";"0";"http://img.metaffiliation.com/c/79/26295/367/photo_4593542189g";"http://img.metaffiliation.com/c/79/26295/367/photo_4593542189g";"http://img.metaffiliation.com/c/79/26295/367/photo_4593542189g";"http://action.metaffiliation.com/trk.php?maff=P466B753FC3113S1UA4593542189V3";"";"";"http://diz1vnif06id7.cloudfront.net/media/catalog/product/B/A/BABL958_2_6.jpg"
"7526295142191";"Loup noir en dentelle";"BABL963_TU";"9,35";"0,00";"9,35";"6,90";"0,00";"€";"Mode & Accessoires > Lingerie > Femme";"1053703";"accessoire";"http://action.metaffiliation.com/trk.php?mclic=P466B753FC3113S1UA4593542191V3";"";"Baci";"4890808100875";"Beauty inside the beast invite chaque femme à révéler l?animal qui sommeille en elle. Féline, cette lingerie du soir donne libre cours à une féminité pleinement assumée.";"";"";"";"13";"1";"0";"0";"0";"0";"http://img.metaffiliation.com/c/79/26295/369/photo_4593542191g";"http://img.metaffiliation.com/c/79/26295/369/photo_4593542191g";"http://img.metaffiliation.com/c/79/26295/369/photo_4593542191g";"http://action.metaffiliation.com/trk.php?maff=P466B753FC3113S1UA4593542191V3";"";"";"http://diz1vnif06id7.cloudfront.net/media/catalog/product/B/A/BABL963_2_6.jpg"
"7526295142193";"Kimono en satin imprimé léopard";"BABL967_TU";"62,90";"0,00";"62,90";"0,00";"0,00";"€";"Mode & Accessoires > Lingerie > Femme";"1053703";"kimono";"http://action.metaffiliation.com/trk.php?mclic=P466B753FC3113S1UA4593542193V3";"";"Baci";"4890808100905";"Beauty inside the beast invite chaque femme à révéler l?animal qui sommeille en elle. Féline, cette lingerie du soir donne libre cours à une féminité pleinement assumée.";"";"";"";"0";"0";"0";"0";"0";"0";"http://img.metaffiliation.com/c/79/26295/371/photo_4593542193g";"http://img.metaffiliation.com/c/79/26295/371/photo_4593542193g";"http://img.metaffiliation.com/c/79/26295/371/photo_4593542193g";"http://action.metaffiliation.com/trk.php?maff=P466B753FC3113S1UA4593542193V3";"";"";"http://diz1vnif06id7.cloudfront.net/media/catalog/product/B/A/BABL967.jpg"
"7526295142195";"Gants noirs en dentelle";"BABL971_TU";"40,85";"0,00";"40,85";"6,90";"0,00";"€";"Mode & Accessoires > Lingerie > Femme";"1053703";"accessoire";"http://action.metaffiliation.com/trk.php?mclic=P466B753FC3113S1UA4593542195V3";"";"Baci";"4890808101100";"Beauty inside the beast invite chaque femme à révéler l?animal qui sommeille en elle. Féline, cette lingerie du soir donne libre cours à une féminité pleinement assumée.";"";"";"";"162";"1";"0";"0";"0";"0";"http://img.metaffiliation.com/c/79/26295/373/photo_4593542195g";"http://img.metaffiliation.com/c/79/26295/373/photo_4593542195g";"http://img.metaffiliation.com/c/79/26295/373/photo_4593542195g";"http://action.metaffiliation.com/trk.php?maff=P466B753FC3113S1UA4593542195V3";"";"";"http://diz1vnif06id7.cloudfront.net/media/catalog/product/B/A/BABL971_2_6.jpg"
"7526295142197";"Ensemble babydoll champagne finitions dentelle noire et ouverture sous poitrine avec string assorti";"BABL992_TU";"30,45";"0,00";"30,45";"6,90";"0,00";"€";"Mode & Accessoires > Lingerie > Femme";"1053703";"nuit";"http://action.metaffiliation.com/trk.php?mclic=P466B753FC3113S1UA4593542197V3";"";"Baci";"4890808101872";"Beauty inside the beast invite chaque femme à révéler l?animal qui sommeille en elle. Féline, cette lingerie du soir donne libre cours à une féminité pleinement assumée.";"";"";"";"1";"0";"0";"0";"0";"0";"http://img.metaffiliation.com/c/79/26295/375/photo_4593542197g";"http://img.metaffiliation.com/c/79/26295/375/photo_4593542197g";"http://img.metaffiliation.com/c/79/26295/375/photo_4593542197g";"http://action.metaffiliation.com/trk.php?maff=P466B753FC3113S1UA4593542197V3";"";"";"http://diz1vnif06id7.cloudfront.net/media/catalog/product/B/A/BABL992_1.jpg"
"7526295142199";"Ensemble soutien gorge triangleen dentelle rose clair";"BAWC025_TU";"21,00";"0,00";"21,00";"6,90";"0,00";"€";"Mode & Accessoires > Lingerie > Femme";"1053703";"ensemble";"http://action.metaffiliation.com/trk.php?mclic=P466B753FC3113S1UA4593542199V3";"";"Baci";"4890808051900";"Ce joli bikini élégant avec Top et culotte est tout simplement sans égal. Le mélange de fines dentelles et de coutures roses clairs crée un look incomparable, qui est astucieusement complété d'un porte-jarretelles. Taille unique. Couleur : rose clair";"";"";"";"96";"1";"0";"0";"0";"0";"http://img.metaffiliation.com/c/79/26295/377/photo_4593542199g";"http://img.metaffiliation.com/c/79/26295/377/photo_4593542199g";"http://img.metaffiliation.com/c/79/26295/377/photo_4593542199g";"http://action.metaffiliation.com/trk.php?maff=P466B753FC3113S1UA4593542199V3";"";"";"http://diz1vnif06id7.cloudfront.net/media/catalog/product/B/A/BAWC025.jpg"
"7526295142201";"Nuisette dos nu en tulle blanche avec un plastron en dentelle blanche";"BAWC026_TU";"20,90";"0,00";"20,90";"6,90";"0,00";"€";"Mode & Accessoires > Lingerie > Femme";"1053703";"nuit";"http://action.metaffiliation.com/trk.php?mclic=P466B753FC3113S1UA4593542201V3";"";"Baci";"4890808051641";"Montrez votre classe - cette robe rose clair-noir à couper le souffle impressionne par ses magnifiques éléments en dentelle sur le devant et la zone ouverte au niveau de la poitrine. La résille fine légèrement transparente ajoute la touche finale à son aspect séduisant. Taille unique. Couleur : rose clair-noir";"";"";"";"1";"0";"0";"0";"0";"0";"http://img.metaffiliation.com/c/79/26295/379/photo_4593542201g";"http://img.metaffiliation.com/c/79/26295/379/photo_4593542201g";"http://img.metaffiliation.com/c/79/26295/379/photo_4593542201g";"http://action.metaffiliation.com/trk.php?maff=P466B753FC3113S1UA4593542201V3";"";"";"http://diz1vnif06id7.cloudfront.net/media/catalog/product/B/A/BAWC026.jpg"
"7526295142203";"Body string ajustable en dentelle blanche avec une fermeture au dos et dans le cou par un lien";"BAWC042_TU";"21,00";"0,00";"21,00";"6,90";"0,00";"€";"Mode & Accessoires > Lingerie > Femme > Bodys";"2148537351";"body";"http://action.metaffiliation.com/trk.php?mclic=P466B753FC3113S1UA4593542203V3";"";"Baci";"4890808052808";"Ce superbe Teddy blanc est le vêtement parfait pour qui aime montrer sa peau. La dentelle  fine, ainsi que le séduisant col en V croisé, se combinent habilement et vous laisse en vouloir toujours plus. Taille unique. Couleur : blanc.";"";"";"";"61";"1";"0";"0";"0";"0";"http://img.metaffiliation.com/c/79/26295/381/photo_4593542203g";"http://img.metaffiliation.com/c/79/26295/381/photo_4593542203g";"http://img.metaffiliation.com/c/79/26295/381/photo_4593542203g";"http://action.metaffiliation.com/trk.php?maff=P466B753FC3113S1UA4593542203V3";"";"";"http://diz1vnif06id7.cloudfront.net/media/catalog/product/B/A/BAWC042.jpg"
"7526295142803";"Soutien Gorge Strass";"ADR-001";"225,00";"0,00";"225,00";"0,00";"0,00";"€";"Mode & Accessoires > Lingerie > Femme > Soutien-gorge";"7517246471";"Soutien-gorge";"http://action.metaffiliation.com/trk.php?mclic=P466B753FC3113S1UA4593542803V3";"";"Baci";"884472021813";"Faites-vous remarquer avec ce soutien gorge en strass brillant : Ce soir c'est soirée Sexy Disco !  Soutien-gorge sexy Rhinestone recouvert de strass.   Taille : 85B à 90C  Matière: 100% alliage  Motif: strass. Marque : Ann Divine";"";"";"";"6";"1";"0";"0";"0";"0";"http://img.metaffiliation.com/c/79/26295/70/photo_4593542803g";"http://img.metaffiliation.com/c/79/26295/70/photo_4593542803g";"http://img.metaffiliation.com/c/79/26295/70/photo_4593542803g";"http://action.metaffiliation.com/trk.php?maff=P466B753FC3113S1UA4593542803V3";"";"";"http://diz1vnif06id7.cloudfront.net/media/catalog/product/a/d/adr-001_1.jpg"
"7526295142205";"Bas noirs";"BABL884_TU";"14,60";"0,00";"14,60";"6,90";"0,00";"€";"Mode & Accessoires > Lingerie > Femme > Bas";"1074795527";"Bas";"http://action.metaffiliation.com/trk.php?mclic=P466B753FC3113S1UA4593542205V3";"";"Baci";"4890808091760";"Bon baiser de Russie se réinvite à travers la collection Agent of love. Des coupes rafinées et structurées feront de vous le temps d?un porter une véritable James Bond girl.";"";"";"";"48";"1";"0";"0";"0";"0";"http://img.metaffiliation.com/c/79/26295/383/photo_4593542205g";"http://img.metaffiliation.com/c/79/26295/383/photo_4593542205g";"http://img.metaffiliation.com/c/79/26295/383/photo_4593542205g";"http://action.metaffiliation.com/trk.php?maff=P466B753FC3113S1UA4593542205V3";"";"";"http://diz1vnif06id7.cloudfront.net/media/catalog/product/B/A/BABL884_1.jpg"
"7526295142207";"Bas en résille avec jarretière travaillée";"BABL885_TU";"26,25";"0,00";"26,25";"6,90";"0,00";"€";"Mode & Accessoires > Lingerie > Femme > Bas";"1074795527";"Bas";"http://action.metaffiliation.com/trk.php?mclic=P466B753FC3113S1UA4593542207V3";"";"Baci";"4890808091777";"Bon baiser de Russie se réinvite à travers la collection Agent of love. Des coupes rafinées et structurées feront de vous le temps d?un porter une véritable James Bond girl.";"";"";"";"77";"1";"0";"0";"0";"0";"http://img.metaffiliation.com/c/79/26295/385/photo_4593542207g";"http://img.metaffiliation.com/c/79/26295/385/photo_4593542207g";"http://img.metaffiliation.com/c/79/26295/385/photo_4593542207g";"http://action.metaffiliation.com/trk.php?maff=P466B753FC3113S1UA4593542207V3";"";"";"http://diz1vnif06id7.cloudfront.net/media/catalog/product/B/A/BABL885_1.jpg"
"7526295142829";"Bracelet Double Strass";"ADR-038";"15,90";"0,00";"15,90";"6,90";"0,00";"€";"Mode & Accessoires > Lingerie > Femme";"1053703";"accessoire";"http://action.metaffiliation.com/trk.php?mclic=P466B753FC3113S1UA4593542829V3";"";"Baci";"884472022186";"Bracelets à 2 rangs de strass extensible. 5 cm de diamètre réglable par élastique  Matière: 100% alliage Motif: strass Un bracelet pour sorties de fêtes Marque : Ann Divine";"";"";"";"341";"1";"0";"0";"0";"0";"http://img.metaffiliation.com/c/79/26295/96/photo_4593542829g";"http://img.metaffiliation.com/c/79/26295/96/photo_4593542829g";"http://img.metaffiliation.com/c/79/26295/96/photo_4593542829g";"http://action.metaffiliation.com/trk.php?maff=P466B753FC3113S1UA4593542829V3";"";"";"http://diz1vnif06id7.cloudfront.net/media/catalog/product/a/d/adr-038_1.jpg"
"7526295142209";"Collants champagne avec jarretelles trompe l'?il";"BABL887_TU";"20,90";"0,00";"20,90";"6,90";"0,00";"€";"Mode & Accessoires > Lingerie > Femme > Bas";"1074795527";"Bas";"http://action.metaffiliation.com/trk.php?mclic=P466B753FC3113S1UA4593542209V3";"";"Baci";"4890808091784";"Bon baiser de Russie se réinvite à travers la collection Agent of love. Des coupes rafinées et structurées feront de vous le temps d?un porter une véritable James Bond girl.";"";"";"";"71";"1";"0";"0";"0";"0";"http://img.metaffiliation.com/c/79/26295/387/photo_4593542209g";"http://img.metaffiliation.com/c/79/26295/387/photo_4593542209g";"http://img.metaffiliation.com/c/79/26295/387/photo_4593542209g";"http://action.metaffiliation.com/trk.php?maff=P466B753FC3113S1UA4593542209V3";"";"";"http://diz1vnif06id7.cloudfront.net/media/catalog/product/B/A/BABL887_1.jpg"
"7526295142211";"Collants noirs travaillés";"BABL931_TU";"16,80";"0,00";"16,80";"6,90";"0,00";"€";"Mode & Accessoires > Lingerie > Femme > Bas";"1074795527";"Bas";"http://action.metaffiliation.com/trk.php?mclic=P466B753FC3113S1UA4593542211V3";"";"Baci";"4890808091944";"Bon baiser de Russie se réinvite à travers la collection Agent of love. Des coupes rafinées et structurées feront de vous le temps d?un porter une véritable James Bond girl.";"";"";"";"51";"1";"0";"0";"0";"0";"http://img.metaffiliation.com/c/79/26295/389/photo_4593542211g";"http://img.metaffiliation.com/c/79/26295/389/photo_4593542211g";"http://img.metaffiliation.com/c/79/26295/389/photo_4593542211g";"http://action.metaffiliation.com/trk.php?maff=P466B753FC3113S1UA4593542211V3";"";"";"http://diz1vnif06id7.cloudfront.net/media/catalog/product/B/A/BABL931_1.jpg"
"7526295142213";"Collants champagne en résille trompe l'?il";"BABL888_TU";"20,90";"0,00";"20,90";"6,90";"0,00";"€";"Mode & Accessoires > Lingerie > Femme > Bas";"1074795527";"Bas";"http://action.metaffiliation.com/trk.php?mclic=P466B753FC3113S1UA4593542213V3";"";"Baci";"4890808091791";"Bon baiser de Russie se réinvite à travers la collection Agent of love. Des coupes rafinées et structurées feront de vous le temps d?un porter une véritable James Bond girl.";"";"";"";"39";"1";"0";"0";"0";"0";"http://img.metaffiliation.com/c/79/26295/391/photo_4593542213g";"http://img.metaffiliation.com/c/79/26295/391/photo_4593542213g";"http://img.metaffiliation.com/c/79/26295/391/photo_4593542213g";"http://action.metaffiliation.com/trk.php?maff=P466B753FC3113S1UA4593542213V3";"";"";"http://diz1vnif06id7.cloudfront.net/media/catalog/product/B/A/BABL888_1.jpg"
"7526295142215";"Collants coutures noires";"BABL941_TU";"8,30";"0,00";"8,30";"6,90";"0,00";"€";"Mode & Accessoires > Lingerie > Femme > Bas";"1074795527";"Bas";"http://action.metaffiliation.com/trk.php?mclic=P466B753FC3113S1UA4593542215V3";"";"Baci";"4890808091951";"Bon baiser de Russie se réinvite à travers la collection Agent of love. Des coupes rafinées et structurées feront de vous le temps d?un porter une véritable James Bond girl.";"";"";"";"79";"1";"0";"0";"0";"0";"http://img.metaffiliation.com/c/79/26295/393/photo_4593542215g";"http://img.metaffiliation.com/c/79/26295/393/photo_4593542215g";"http://img.metaffiliation.com/c/79/26295/393/photo_4593542215g";"http://action.metaffiliation.com/trk.php?maff=P466B753FC3113S1UA4593542215V3";"";"";"http://diz1vnif06id7.cloudfront.net/media/catalog/product/B/A/BABL941_1.jpg"
"7526295142823";"Boucle D'Oreilles Clous Large";"ADR-035";"15,90";"0,00";"15,90";"6,90";"0,00";"€";"Mode & Accessoires > Lingerie > Femme";"1053703";"accessoire";"http://action.metaffiliation.com/trk.php?mclic=P466B753FC3113S1UA4593542823V3";"";"Baci";"884472022155";"Boucles d'oreilles clous en strass grands.Diamètre: 1 cm Matière: 100% alliage Motif: strass Des boucles d'oreilles très sexy qui mettront en valeur votre tenue de soirée ou votre nudité Marque : Ann Divine";"";"";"";"84";"1";"0";"0";"0";"0";"http://img.metaffiliation.com/c/79/26295/90/photo_4593542823g";"http://img.metaffiliation.com/c/79/26295/90/photo_4593542823g";"http://img.metaffiliation.com/c/79/26295/90/photo_4593542823g";"http://action.metaffiliation.com/trk.php?maff=P466B753FC3113S1UA4593542823V3";"";"";"http://diz1vnif06id7.cloudfront.net/media/catalog/product/a/d/adr-035_1_1.jpg"
"7526295142217";"Collants jarretelles noirs en résille";"BABL898_TU";"10,40";"0,00";"10,40";"6,90";"0,00";"€";"Mode & Accessoires > Lingerie > Femme > Bas";"1074795527";"Bas";"http://action.metaffiliation.com/trk.php?mclic=P466B753FC3113S1UA4593542217V3";"";"Baci";"4890808091838";"Bon baiser de Russie se réinvite à travers la collection Agent of love. Des coupes rafinées et structurées feront de vous le temps d?un porter une véritable James Bond girl.";"";"";"";"0";"0";"0";"0";"0";"0";"http://img.metaffiliation.com/c/79/26295/395/photo_4593542217g";"http://img.metaffiliation.com/c/79/26295/395/photo_4593542217g";"http://img.metaffiliation.com/c/79/26295/395/photo_4593542217g";"http://action.metaffiliation.com/trk.php?maff=P466B753FC3113S1UA4593542217V3";"";"";"http://diz1vnif06id7.cloudfront.net/media/catalog/product/B/A/BABL898.jpg"
"7526295142219";"Bas noirs à motifs rayés";"BABL943_TU";"15,65";"0,00";"15,65";"6,90";"0,00";"€";"Mode & Accessoires > Lingerie > Femme > Bas";"1074795527";"Bas";"http://action.metaffiliation.com/trk.php?mclic=P466B753FC3113S1UA4593542219V3";"";"Baci";"4890808091814";"Bon baiser de Russie se réinvite à travers la collection Agent of love. Des coupes rafinées et structurées feront de vous le temps d?un porter une véritable James Bond girl.";"";"";"";"0";"0";"0";"0";"0";"0";"http://img.metaffiliation.com/c/79/26295/397/photo_4593542219g";"http://img.metaffiliation.com/c/79/26295/397/photo_4593542219g";"http://img.metaffiliation.com/c/79/26295/397/photo_4593542219g";"http://action.metaffiliation.com/trk.php?maff=P466B753FC3113S1UA4593542219V3";"";"";"http://diz1vnif06id7.cloudfront.net/media/catalog/product/B/A/BABL943_1.jpg"
"7526295142221";"Collants noirs travaillés";"BABL953_TU";"14,60";"0,00";"14,60";"6,90";"0,00";"€";"Mode & Accessoires > Lingerie > Femme > Bas";"1074795527";"Bas";"http://action.metaffiliation.com/trk.php?mclic=P466B753FC3113S1UA4593542221V3";"";"Baci";"4890808091982";"Beauty inside the beast invite chaque femme à révéler l?animal qui sommeille en elle. Féline, cette lingerie du soir donne libre cours à une féminité pleinement assumée.";"";"";"";"81";"1";"0";"0";"0";"0";"http://img.metaffiliation.com/c/79/26295/399/photo_4593542221g";"http://img.metaffiliation.com/c/79/26295/399/photo_4593542221g";"http://img.metaffiliation.com/c/79/26295/399/photo_4593542221g";"http://action.metaffiliation.com/trk.php?maff=P466B753FC3113S1UA4593542221V3";"";"";"http://diz1vnif06id7.cloudfront.net/media/catalog/product/B/A/BABL953_1.jpg"
"7526295142223";"Bas noirs avec jarretière ruban satin noir";"BABL956_TU";"14,60";"0,00";"14,60";"6,90";"0,00";"€";"Mode & Accessoires > Lingerie > Femme > Bas";"1074795527";"Bas";"http://action.metaffiliation.com/trk.php?mclic=P466B753FC3113S1UA4593542223V3";"";"Baci";"4890808092002";"Beauty inside the beast invite chaque femme à révéler l?animal qui sommeille en elle. Féline, cette lingerie du soir donne libre cours à une féminité pleinement assumée.";"";"";"";"1";"0";"0";"0";"0";"0";"http://img.metaffiliation.com/c/79/26295/401/photo_4593542223g";"http://img.metaffiliation.com/c/79/26295/401/photo_4593542223g";"http://img.metaffiliation.com/c/79/26295/401/photo_4593542223g";"http://action.metaffiliation.com/trk.php?maff=P466B753FC3113S1UA4593542223V3";"";"";"http://diz1vnif06id7.cloudfront.net/media/catalog/product/B/A/BABL956_1.jpg"
"7526295142225";"Bas noirs en résille avec jarretière dentelle";"BABL957_TU";"15,65";"0,00";"15,65";"6,90";"0,00";"€";"Mode & Accessoires > Lingerie > Femme > Bas";"1074795527";"Bas";"http://action.metaffiliation.com/trk.php?mclic=P466B753FC3113S1UA4593542225V3";"";"Baci";"4890808092019";"Beauty inside the beast invite chaque femme à révéler l?animal qui sommeille en elle. Féline, cette lingerie du soir donne libre cours à une féminité pleinement assumée.";"";"";"";"49";"1";"0";"0";"0";"0";"http://img.metaffiliation.com/c/79/26295/403/photo_4593542225g";"http://img.metaffiliation.com/c/79/26295/403/photo_4593542225g";"http://img.metaffiliation.com/c/79/26295/403/photo_4593542225g";"http://action.metaffiliation.com/trk.php?maff=P466B753FC3113S1UA4593542225V3";"";"";"http://diz1vnif06id7.cloudfront.net/media/catalog/product/B/A/BABL957_1.jpg"
"7526295142227";"Bas en résille large";"BABL960_TU";"11,55";"0,00";"11,55";"6,90";"0,00";"€";"Mode & Accessoires > Lingerie > Femme > Bas";"1074795527";"Bas";"http://action.metaffiliation.com/trk.php?mclic=P466B753FC3113S1UA4593542227V3";"";"Baci";"4890808092026";"Beauty inside the beast invite chaque femme à révéler l?animal qui sommeille en elle. Féline, cette lingerie du soir donne libre cours à une féminité pleinement assumée.";"";"";"";"4";"0";"0";"0";"0";"0";"http://img.metaffiliation.com/c/79/26295/405/photo_4593542227g";"http://img.metaffiliation.com/c/79/26295/405/photo_4593542227g";"http://img.metaffiliation.com/c/79/26295/405/photo_4593542227g";"http://action.metaffiliation.com/trk.php?maff=P466B753FC3113S1UA4593542227V3";"";"";"http://diz1vnif06id7.cloudfront.net/media/catalog/product/B/A/BABL960_1.jpg"
"7526295142229";"Bas en résille avec jarretière vernis";"BABL961_TU";"21,00";"0,00";"21,00";"6,90";"0,00";"€";"Mode & Accessoires > Lingerie > Femme > Bas";"1074795527";"Bas";"http://action.metaffiliation.com/trk.php?mclic=P466B753FC3113S1UA4593542229V3";"";"Baci";"4890808092033";"Beauty inside the beast invite chaque femme à révéler l?animal qui sommeille en elle. Féline, cette lingerie du soir donne libre cours à une féminité pleinement assumée.";"";"";"";"44";"1";"0";"0";"0";"0";"http://img.metaffiliation.com/c/79/26295/407/photo_4593542229g";"http://img.metaffiliation.com/c/79/26295/407/photo_4593542229g";"http://img.metaffiliation.com/c/79/26295/407/photo_4593542229g";"http://action.metaffiliation.com/trk.php?maff=P466B753FC3113S1UA4593542229V3";"";"";"http://diz1vnif06id7.cloudfront.net/media/catalog/product/B/A/BABL961_1.jpg"
"7526295142231";"Collants Jacquart noirs";"BABL964_TU";"16,80";"0,00";"16,80";"6,90";"0,00";"€";"Mode & Accessoires > Lingerie > Femme > Bas";"1074795527";"Bas";"http://action.metaffiliation.com/trk.php?mclic=P466B753FC3113S1UA4593542231V3";"";"Baci";"4890808092040";"Beauty inside the beast invite chaque femme à révéler l?animal qui sommeille en elle. Féline, cette lingerie du soir donne libre cours à une féminité pleinement assumée.";"";"";"";"47";"1";"0";"0";"0";"0";"http://img.metaffiliation.com/c/79/26295/409/photo_4593542231g";"http://img.metaffiliation.com/c/79/26295/409/photo_4593542231g";"http://img.metaffiliation.com/c/79/26295/409/photo_4593542231g";"http://action.metaffiliation.com/trk.php?maff=P466B753FC3113S1UA4593542231V3";"";"";"http://diz1vnif06id7.cloudfront.net/media/catalog/product/B/A/BABL964_1.jpg"
